{
  "signal_id": "SIG-20260620-e420a56a",
  "event_id": "EVT-1afb1afeddc5",
  "processed_at": "2026-06-20T12:00:00.000Z",
  "gate0": {
    "approved_source_check": true,
    "source_grade": "B",
    "source_grade_rationale": "Outlook Business is Indian business financial press (approved list, Jun 2026 expansion block); Grade B as a secondary aggregator — not a primary newswire or official exchange filing.",
    "dedup_url_hash": "EVT-1afb1afeddc5"
  },
  "relevance_label": "material",
  "relevance_confidence": 0.97,
  "event_types": ["capital_actions", "debt_credit", "regulatory", "product"],
  "entities": {
    "primary_issuers": ["Jio Platforms Limited"],
    "secondary_issuers": [
      "Reliance Industries Limited",
      "Meta Platforms",
      "Google International LLC",
      "Saudi Arabia Public Investment Fund",
      "KKR",
      "Vista Equity Partners",
      "Mubadala",
      "General Atlantic"
    ],
    "sector": "Telecommunications / Digital Services",
    "geography": "India",
    "commodity": ""
  },
  "issuer_linkage": "primary_issuer",
  "similarity_score": 0.0,
  "similar_event_ids": [],
  "pair_label": "new_event",
  "fact_delta": 0.0,
  "fact_delta_fields": [],
  "confirmation_upgrade": false,
  "novelty_score": 0.85,
  "action": "keep_separate",
  "materiality_score": 90,
  "materiality_math": "Base 72 (major SEBI regulatory capital event, direct primary issuer, India-wide scope, Grade B source) + novelty 13 (0.85 × 15, new_event band) − penalties 0 (new_event, no prior match) + override 5 (DRHP is an official SEBI regulatory filing) = 90/100",
  "routing": "PROMOTE",
  "routing_reason": "Jio Platforms DRHP filing is India's potentially largest-ever IPO — a first-seen, primary-issuer capital and regulatory event with materiality 90, well above the 70-point PROMOTE threshold.",
  "next_action": "thesis-structure",
  "sources": [
    {
      "url": "https://www.outlookbusiness.com/markets/jio-files-for-mega-ipo-debt-reduction-ai-ambitions-and-a-new-valuation-story",
      "source_name": "Outlook Business",
      "source_grade": "B",
      "retrieved_at": "2026-06-20T11:31:54.179Z",
      "claim_supported": "Jio Platforms filed DRHP with SEBI for a fresh issue of up to 27 crore shares (~Rs 37,700 crore); Rs 27,500 crore earmarked for debt repayment; Reliance Industries 66.43% pre-IPO; AI investment narrative stated as strategic rationale."
    }
  ]
}
